{
  "country_id": "canada",
  "country_name": "加拿大",
  "updated_at": "2026-01-15T00:00:00Z",
  "source": "加拿大移民部 (IRCC)",
  "visa_types": [
    {
      "id": "ca_tourist",
      "type": "visa_required",
      "name": "访客签证（Visitor Visa / TRV）",
      "name_en": "Canada Visitor Visa",
      "duration": "6个月/次",
      "validity": "10年多次（或护照到期日）",
      "extendable": true,
      "extend_duration": "6个月（境内申请）",
      "fee_usd": 100,
      "processing_days": 30,
      "application_method": "online",
      "requirements": [
        "在线申请",
        "有效护照",
        "资金证明",
        "无移民倾向",
        "体检（可能）"
      ],
      "documents": [
        "护照",
        "照片",
        "资金证明",
        "在职证明",
        "行程单",
        "家庭关系证明"
      ],
      "official_url": "https://www.canada.ca/en/immigration-refugees-citizenship/services/visit-canada/visitor-visa.html",
      "china_passport_eligible": true,
      "notes": "可在线申请，通常与护照有效期同步。入境时边境官员决定停留时间（通常6个月）",
      "is_recommended_for_digital_nomad": true
    },
    {
      "id": "ca_ee",
      "type": "work_visa",
      "name": "快速通道（Express Entry）- FSW",
      "name_en": "Canada Express Entry (FSW)",
      "duration": "永久居留",
      "validity": "永久",
      "extendable": false,
      "fee_usd": 2300,
      "processing_days": 180,
      "application_method": "online",
      "requirements": [
        "67分评分标准",
        "1年连续NOC 0/1/2/3工作经验",
        "CLB 7英语（雅思4个6）",
        "学历认证（ECA）",
        "资金证明"
      ],
      "documents": [
        "护照",
        "照片",
        "学历证明",
        "ECA报告",
        "雅思成绩",
        "工作证明",
        "资金证明",
        "体检报告",
        "无犯罪记录证明"
      ],
      "official_url": "https://www.canada.ca/en/immigration-refugees-citizenship/services/immigrate-canada/express-entry.html",
      "china_passport_eligible": true,
      "notes": "技术移民快速通道，CRS打分制。目前邀请分数约500+（2024-2025）。LMIA或省提名可大幅加分",
      "is_recommended_for_digital_nomad": false
    },
    {
      "id": "ca_wpv",
      "type": "work_visa",
      "name": "开放式工作签证（Open Work Permit）",
      "name_en": "Canada Open Work Permit",
      "duration": "1-3年",
      "validity": "1-3年",
      "extendable": true,
      "extend_duration": "1-3年",
      "fee_usd": 255,
      "processing_days": 120,
      "application_method": "online",
      "requirements": [
        "特定资格（如毕业生、配偶、难民等）",
        "无特定雇主限制"
      ],
      "documents": [
        "护照",
        "照片",
        "资格证明",
        "体检报告",
        "资金证明"
      ],
      "official_url": "https://www.canada.ca/en/immigration-refugees-citizenship/services/work-canada/permit/temporary/open-work-permit.html",
      "china_passport_eligible": true,
      "notes": "毕业后工签（PGWP）、配偶工签、桥梁工签等均属于开放式工签，可为任意雇主工作",
      "is_recommended_for_digital_nomad": false
    }
  ]
}