{
  "country_id": "southkorea",
  "country_name": "韩国",
  "updated_at": "2026-01-15T00:00:00Z",
  "source": "韩国驻华大使馆, 韩国旅游发展局",
  "visa_types": [
    {
      "id": "kr_tourist",
      "type": "visa_required",
      "name": "旅游签证（C-3-9）",
      "name_en": "Korea Tourist Visa",
      "duration": "90天",
      "validity": "3个月-5年",
      "extendable": false,
      "fee_usd": 40,
      "processing_days": 7,
      "application_method": "embassy",
      "requirements": [
        "有效护照",
        "往返机票",
        "酒店预订",
        "资金证明"
      ],
      "documents": [
        "护照",
        "照片",
        "申请表",
        "身份证",
        "在职证明",
        "银行流水",
        "行程单"
      ],
      "official_url": "https://www.visa.go.kr/",
      "china_passport_eligible": true,
      "notes": "可通过韩国签证申请中心（VFS）递交，部分城市需预约",
      "is_recommended_for_digital_nomad": true
    },
    {
      "id": "kr_jeju",
      "type": "visa_free",
      "name": "济州岛免签",
      "name_en": "Jeju Island Visa-Free Entry",
      "duration": "30天",
      "validity": "30天",
      "extendable": false,
      "fee_usd": 0,
      "processing_days": 0,
      "application_method": "on_arrival",
      "requirements": [
        "直飞济州岛",
        "有效护照",
        "回程机票",
        "酒店预订"
      ],
      "documents": [
        "护照",
        "往返机票",
        "酒店预订"
      ],
      "official_url": "https://www.visa.go.kr/",
      "china_passport_eligible": true,
      "notes": "仅限济州岛，不可进入韩国本土。若从济州岛前往首尔需提前办理韩国签证",
      "is_recommended_for_digital_nomad": true
    },
    {
      "id": "kr_digital_nomad",
      "type": "digital_nomad_visa",
      "name": "数字游民签证（F-1-D）",
      "name_en": "Korea Digital Nomad Visa",
      "duration": "1年",
      "validity": "1年",
      "extendable": true,
      "extend_duration": "1年",
      "fee_usd": 0,
      "processing_days": 30,
      "application_method": "embassy",
      "requirements": [
        "年收入约6500万韩元+（约35万人民币）",
        "加入韩国国民健康保险或等效保险",
        "远程工作证明"
      ],
      "documents": [
        "护照",
        "照片",
        "申请表",
        "收入证明",
        "税单",
        "保险证明",
        "远程工作合同"
      ],
      "official_url": "https://www.visa.go.kr/",
      "china_passport_eligible": true,
      "notes": "2024年推出，可在韩国全境工作居住，可携家属",
      "is_recommended_for_digital_nomad": true
    }
  ]
}