{
  "country_id": "australia",
  "country_name": "澳大利亚",
  "updated_at": "2026-01-15T00:00:00Z",
  "source": "澳大利亚内政部, 澳大利亚驻华大使馆",
  "visa_types": [
    {
      "id": "au_tourist_600",
      "type": "visa_required",
      "name": "旅游签证（600类别）",
      "name_en": "Australia Visitor Visa (Subclass 600)",
      "duration": "3-12个月",
      "validity": "1年或3年",
      "extendable": false,
      "fee_usd": 150,
      "processing_days": 14,
      "application_method": "online",
      "requirements": [
        "在线递交",
        "有效护照",
        "资金证明",
        "真实访客意图",
        "健康和品格要求"
      ],
      "documents": [
        "护照",
        "照片",
        "身份证",
        "户口本",
        "在职证明",
        "银行流水",
        "行程单",
        "资金证明"
      ],
      "official_url": "https://immi.homeaffairs.gov.au/visas/getting-a-visa/visa-listing/visitor-600",
      "china_passport_eligible": true,
      "notes": "可在线申请，通常审批2-4周。3年多次需通过指定旅行社（KDP）申请。审批较严格，需证明回国约束力",
      "is_recommended_for_digital_nomad": true
    },
    {
      "id": "au_whv_462",
      "type": "work_visa",
      "name": "打工度假签证（462类别）",
      "name_en": "Australia Work and Holiday Visa (Subclass 462)",
      "duration": "1年",
      "validity": "1年",
      "extendable": true,
      "extend_duration": "1年（满足特定工作条件）",
      "fee_usd": 510,
      "processing_days": 30,
      "application_method": "online",
      "requirements": [
        "18-30岁（含）",
        "大专以上学历或完成至少两年大学课程",
        "英语成绩（雅思4.5或同等）",
        "资金证明5000澳元+"
      ],
      "documents": [
        "护照",
        "照片",
        "学历证明",
        "英语成绩",
        "资金证明",
        "体检报告"
      ],
      "official_url": "https://immi.homeaffairs.gov.au/visas/getting-a-visa/visa-listing/work-and-holiday-462",
      "china_passport_eligible": true,
      "notes": "中国名额每年5000个，需抽签（Ballot）。2024年起改为预申请+抽签制",
      "is_recommended_for_digital_nomad": true
    },
    {
      "id": "au_student",
      "type": "student_visa",
      "name": "学生签证（500类别）",
      "name_en": "Australia Student Visa (Subclass 500)",
      "duration": "按课程长度",
      "validity": "按课程长度+2-4个月",
      "extendable": true,
      "extend_duration": "按新课程",
      "fee_usd": 630,
      "processing_days": 30,
      "application_method": "online",
      "requirements": [
        "获得澳大利亚教育机构录取（CoE）",
        "资金证明",
        "英语成绩",
        "海外学生健康保险（OSHC）",
        "真实学生要求（GTE）"
      ],
      "documents": [
        "护照",
        "照片",
        "CoE",
        "学历证明",
        "英语成绩",
        "资金证明",
        "OSHC",
        "GTE陈述"
      ],
      "official_url": "https://immi.homeaffairs.gov.au/visas/getting-a-visa/visa-listing/student-500",
      "china_passport_eligible": true,
      "notes": "可在课余时间工作（每两周48小时），毕业后可申请工签",
      "is_recommended_for_digital_nomad": false
    }
  ]
}