{
  "country_id": "newzealand",
  "country_name": "新西兰",
  "updated_at": "2026-01-15T00:00:00Z",
  "source": "新西兰移民局",
  "visa_types": [
    {
      "id": "nz_tourist",
      "type": "visa_required",
      "name": "旅游签证",
      "name_en": "New Zealand Visitor Visa",
      "duration": "9个月",
      "validity": "多次（通常5年）",
      "extendable": false,
      "fee_usd": 246,
      "processing_days": 30,
      "application_method": "online",
      "requirements": [
        "在线递交",
        "有效护照",
        "资金证明",
        "真实访客意图",
        "回程机票"
      ],
      "documents": [
        "护照",
        "照片",
        "身份证",
        "户口本",
        "在职证明",
        "银行流水",
        "行程单"
      ],
      "official_url": "https://www.immigration.govt.nz/new-zealand-visas/apply-for-a-visa/about-visa/visitor-visa",
      "china_passport_eligible": true,
      "notes": "可在线申请，通常5年多次。可停留总计不超过9个月（每12个月内）",
      "is_recommended_for_digital_nomad": true
    },
    {
      "id": "nz_whv",
      "type": "work_visa",
      "name": "打工度假签证（WHV）",
      "name_en": "New Zealand Working Holiday Visa",
      "duration": "1年",
      "validity": "1年",
      "extendable": false,
      "fee_usd": 420,
      "processing_days": 30,
      "application_method": "online",
      "requirements": [
        "18-30岁",
        "高中以上学历",
        "资金证明4200纽币+",
        "购买往返机票或有足够资金",
        "名额1000个/年（先到先得）"
      ],
      "documents": [
        "护照",
        "照片",
        "学历证明",
        "资金证明",
        "体检报告",
        "机票或资金证明"
      ],
      "official_url": "https://www.immigration.govt.nz/new-zealand-visas/apply-for-a-visa/about-visa/working-holiday-visa",
      "china_passport_eligible": true,
      "notes": "中国名额每年1000个，先到先得（需抢名额）。通常每年8月开放申请",
      "is_recommended_for_digital_nomad": true
    }
  ]
}