{
  "country_id": "portugal",
  "country_name": "葡萄牙",
  "updated_at": "2026-01-15T00:00:00Z",
  "source": "葡萄牙移民局 (SEF), 葡萄牙驻华大使馆",
  "visa_types": [
    {
      "id": "pt_d7",
      "type": "digital_nomad_visa",
      "name": "D7 被动收入/数字游民签证",
      "name_en": "Portugal D7 Passive Income / Digital Nomad Visa",
      "duration": "1年",
      "validity": "1年（居留许可）",
      "extendable": true,
      "extend_duration": "2年（续签后）",
      "fee_usd": 180,
      "processing_days": 60,
      "application_method": "embassy",
      "requirements": [
        "月收入达到葡萄牙最低工资（约820欧元/月，2024年）或存款证明",
        "葡萄牙住址",
        "无犯罪记录",
        "健康保险",
        "远程工作合同或被动收入证明"
      ],
      "documents": [
        "护照",
        "照片",
        "申请表",
        "收入证明",
        "银行流水",
        "葡萄牙住址证明",
        "无犯罪记录证明",
        "健康保险",
        "NIF（税号）"
      ],
      "official_url": "https://www.sef.pt/",
      "china_passport_eligible": true,
      "notes": "最适合数字游民的签证。可在葡萄牙居住，5年后可申请永居或国籍（欧盟最低居住要求）",
      "is_recommended_for_digital_nomad": true
    },
    {
      "id": "pt_golden",
      "type": "special_permit",
      "name": "黄金签证（已改革）",
      "name_en": "Portugal Golden Visa",
      "duration": "1年",
      "validity": "1年（居留许可）",
      "extendable": true,
      "extend_duration": "2年",
      "fee_usd": 50000,
      "processing_days": 90,
      "application_method": "agent",
      "requirements": [
        "投资50万欧元基金（2024年新政）或创造10个就业岗位",
        "无犯罪记录",
        "健康保险"
      ],
      "documents": [
        "护照",
        "照片",
        "申请表",
        "投资证明",
        "无犯罪记录证明",
        "健康保险"
      ],
      "official_url": "https://www.aima.gov.pt/",
      "china_passport_eligible": true,
      "notes": "2023年已取消购房移民。现可选基金投资（50万欧）或创造就业。每年仅需居住7天，5年后可申永居/国籍",
      "is_recommended_for_digital_nomad": false
    },
    {
      "id": "pt_schengen_tourist",
      "type": "visa_required",
      "name": "申根旅游签证（C类）",
      "name_en": "Portugal Schengen Tourist Visa",
      "duration": "90天/180天",
      "validity": "90天-5年",
      "extendable": false,
      "fee_usd": 90,
      "processing_days": 15,
      "application_method": "embassy",
      "requirements": [
        "有效护照",
        "旅行保险",
        "往返机票",
        "酒店预订",
        "资金证明",
        "行程单"
      ],
      "documents": [
        "护照",
        "照片",
        "申请表",
        "旅行保险",
        "机票",
        "酒店预订",
        "银行流水",
        "在职证明"
      ],
      "official_url": "https://www.vfsglobal.cn/portugal/china/",
      "china_passport_eligible": true,
      "notes": "葡萄牙为申根区，C类签证可通行29个申根国。首次申请通常给90天单次",
      "is_recommended_for_digital_nomad": true
    }
  ]
}