{
  "country_id": "uk",
  "country_name": "英国",
  "updated_at": "2026-01-15T00:00:00Z",
  "source": "英国内政部, GOV.UK",
  "visa_types": [
    {
      "id": "uk_standard_visitor",
      "type": "visa_required",
      "name": "标准访客签证",
      "name_en": "UK Standard Visitor Visa",
      "duration": "6个月",
      "validity": "2年/5年/10年多次",
      "extendable": false,
      "fee_usd": 115,
      "processing_days": 15,
      "application_method": "online",
      "requirements": [
        "在线申请",
        "有效护照",
        "资金证明",
        "回程机票",
        "在英国期间住宿安排",
        "无长期居留或工作意图"
      ],
      "documents": [
        "护照",
        "照片",
        "资金证明",
        "在职证明",
        "行程单",
        "酒店预订/邀请函"
      ],
      "official_url": "https://www.gov.uk/standard-visitor-visa",
      "china_passport_eligible": true,
      "notes": "可在线申请，2年多次约115英镑，5年约862英镑，10年约1070英镑。可停留6个月/次，每12个月不超过6个月",
      "is_recommended_for_digital_nomad": true
    },
    {
      "id": "uk_skilled_worker",
      "type": "work_visa",
      "name": "技术工签（Skilled Worker Visa）",
      "name_en": "UK Skilled Worker Visa",
      "duration": "5年",
      "validity": "5年",
      "extendable": true,
      "extend_duration": "5年",
      "fee_usd": 800,
      "processing_days": 30,
      "application_method": "online",
      "requirements": [
        "英国雇主担保（需持担保牌照）",
        "年薪达到门槛（通常£26,200+）",
        "英语B1水平",
        "职位在RQF Level 3+"
      ],
      "documents": [
        "护照",
        "照片",
        "CoS（担保证书）",
        "学历证明",
        "英语成绩",
        "资金证明",
        "体检报告（肺结核）"
      ],
      "official_url": "https://www.gov.uk/skilled-worker-visa",
      "china_passport_eligible": true,
      "notes": "前Tier 2 General签证，需雇主担保。5年后可申请永居（ILR）",
      "is_recommended_for_digital_nomad": false
    }
  ]
}