{
  "country_id": "singapore",
  "country_name": "新加坡",
  "updated_at": "2026-01-15T00:00:00Z",
  "source": "新加坡移民与关卡局 (ICA)",
  "visa_types": [
    {
      "id": "sg_tourist",
      "type": "visa_required",
      "name": "旅游签证（Entry Visa）",
      "name_en": "Singapore Tourist Visa",
      "duration": "30天",
      "validity": "2年多次",
      "extendable": false,
      "fee_usd": 30,
      "processing_days": 3,
      "application_method": "agent",
      "requirements": [
        "需通过新加坡本地担保人或指定旅行社申请",
        "有效护照",
        "往返机票",
        "酒店预订"
      ],
      "documents": [
        "护照",
        "照片",
        "申请表",
        "行程单",
        "酒店预订",
        "资金证明"
      ],
      "official_url": "https://www.ica.gov.sg/enter-transit-depart/enter",
      "china_passport_eligible": true,
      "notes": "不可自行在线申请，需通过新加坡公民/PR担保或授权旅行社",
      "is_recommended_for_digital_nomad": true
    },
    {
      "id": "sg_ep",
      "type": "work_visa",
      "name": "就业准证（Employment Pass）",
      "name_en": "Employment Pass",
      "duration": "1-2年",
      "validity": "1-2年",
      "extendable": true,
      "extend_duration": "1-3年",
      "fee_usd": 225,
      "processing_days": 14,
      "application_method": "online",
      "requirements": [
        "新加坡雇主担保",
        "月薪5000新币+（2025年起）",
        "学历证明",
        "工作经验"
      ],
      "documents": [
        "护照",
        "学历证明",
        "工作合同",
        "照片"
      ],
      "official_url": "https://www.mom.gov.sg/passes-and-permits/employment-pass",
      "china_passport_eligible": true,
      "notes": "需要新加坡雇主担保，可后续申请PR",
      "is_recommended_for_digital_nomad": false
    }
  ]
}