{
  "country_id": "vietnam",
  "country_name": "越南",
  "updated_at": "2026-01-15T00:00:00Z",
  "source": "越南移民局, 越南电子签证官网",
  "visa_types": [
    {
      "id": "vn_evisa",
      "type": "evisa",
      "name": "电子签证（E-Visa）",
      "name_en": "Vietnam E-Visa",
      "duration": "90天",
      "validity": "90天（单次或多次）",
      "extendable": false,
      "fee_usd": 25,
      "processing_days": 3,
      "application_method": "online",
      "requirements": [
        "有效护照（6个月以上）",
        "护照照片",
        "入境口岸信息"
      ],
      "documents": [
        "护照扫描件",
        "照片"
      ],
      "official_url": "https://evisa.xuatnhapcanh.gov.vn/",
      "china_passport_eligible": true,
      "notes": "2023年8月起电子签证有效期延长至90天（单次或多次），可在线申请，3个工作日获批",
      "is_recommended_for_digital_nomad": true
    },
    {
      "id": "vn_business",
      "type": "business_visa",
      "name": "商务签证（DN）",
      "name_en": "Vietnam Business Visa",
      "duration": "90天-1年",
      "validity": "90天-1年",
      "extendable": true,
      "extend_duration": "90天-1年",
      "fee_usd": 130,
      "processing_days": 7,
      "application_method": "agent",
      "requirements": [
        "越南公司担保函",
        "有效护照",
        "商务目的证明"
      ],
      "documents": [
        "护照",
        "照片",
        "担保函",
        "营业执照"
      ],
      "official_url": "https://evisa.xuatnhapcanh.gov.vn/",
      "china_passport_eligible": true,
      "notes": "可通过越南当地公司担保，在越南境内可延期，部分DN签证可多次往返",
      "is_recommended_for_digital_nomad": true
    }
  ]
}