{
  "country_id": "france",
  "country_name": "法国",
  "updated_at": "2026-01-15T00:00:00Z",
  "source": "法国移民局, 法国驻华大使馆",
  "visa_types": [
    {
      "id": "fr_schengen",
      "type": "visa_required",
      "name": "申根旅游签证（C类）",
      "name_en": "France Schengen Tourist Visa",
      "duration": "90天/180天",
      "validity": "90天-5年",
      "extendable": false,
      "fee_usd": 90,
      "processing_days": 15,
      "application_method": "embassy",
      "requirements": [
        "有效护照",
        "旅行保险",
        "往返机票",
        "酒店预订",
        "资金证明",
        "行程单",
        "在职证明"
      ],
      "documents": [
        "护照",
        "照片",
        "申请表",
        "旅行保险",
        "机票",
        "酒店预订",
        "银行流水",
        "在职证明",
        "户口本",
        "营业执照"
      ],
      "official_url": "https://france-visas.gouv.fr/",
      "china_passport_eligible": true,
      "notes": "法国为申根区，C类签证可通行29个申根国。法国签证审核较严谨，资金证明需充分",
      "is_recommended_for_digital_nomad": true
    },
    {
      "id": "fr_talent_passport",
      "type": "work_visa",
      "name": "人才护照（Passeport Talent）",
      "name_en": "France Talent Passport",
      "duration": "4年",
      "validity": "4年",
      "extendable": true,
      "extend_duration": "4年",
      "fee_usd": 99,
      "processing_days": 30,
      "application_method": "embassy",
      "requirements": [
        "符合10类人才标准之一（投资者、创业者、高技能、艺术家、研究人员等）",
        "法国项目/雇主/机构担保",
        "资金证明"
      ],
      "documents": [
        "护照",
        "照片",
        "申请表",
        "项目证明/工作合同",
        "资金证明",
        "学历证明",
        "专业资质证明"
      ],
      "official_url": "https://france-visas.gouv.fr/",
      "china_passport_eligible": true,
      "notes": "可携家属，家属可工作。可转10年长居或入籍。适合创业者、艺术家、高技能专业人士",
      "is_recommended_for_digital_nomad": true
    }
  ]
}