{
  "country_id": "hongkong",
  "country_name": "香港",
  "updated_at": "2026-01-15T00:00:00Z",
  "source": "香港入境事务处, 中国驻香港大使馆",
  "visa_types": [
    {
      "id": "hk_entry_permit",
      "type": "special_permit",
      "name": "港澳通行证 + 香港签注",
      "name_en": "Entry Permit for Hong Kong",
      "duration": "7-90天（根据签注类型）",
      "validity": "3个月-1年",
      "extendable": false,
      "fee_usd": 15,
      "processing_days": 7,
      "application_method": "online",
      "requirements": [
        "有效中国护照",
        "港澳通行证",
        "香港签注（G签个人旅游或L签团队旅游）"
      ],
      "documents": [
        "身份证",
        "户口本",
        "照片",
        "申请表"
      ],
      "official_url": "https://www.immd.gov.hk/hkt/services/visas/visit_transit.html",
      "china_passport_eligible": true,
      "notes": "内地居民必须持港澳通行证+有效签注入境香港，不可仅凭护照",
      "is_recommended_for_digital_nomad": true
    },
    {
      "id": "hk_work_visa",
      "type": "work_visa",
      "name": "工作签证（General Employment Policy）",
      "name_en": "Hong Kong Work Visa",
      "duration": "2-3年",
      "validity": "2-3年",
      "extendable": true,
      "extend_duration": "2-3年",
      "fee_usd": 230,
      "processing_days": 30,
      "application_method": "online",
      "requirements": [
        "已获得香港雇主聘用",
        "学历证明",
        "工作经验证明",
        "雇主担保"
      ],
      "documents": [
        "护照",
        "学历证明",
        "工作证明",
        "雇主申请表",
        "照片"
      ],
      "official_url": "https://www.immd.gov.hk/hkt/services/visas/employment.html",
      "china_passport_eligible": true,
      "notes": "需要雇主担保，高才通/优才计划可自雇",
      "is_recommended_for_digital_nomad": false
    },
    {
      "id": "hk_talent",
      "type": "special_permit",
      "name": "高端人才通行证计划（高才通）",
      "name_en": "Top Talent Pass Scheme",
      "duration": "2年",
      "validity": "2年",
      "extendable": true,
      "extend_duration": "3年",
      "fee_usd": 0,
      "processing_days": 14,
      "application_method": "online",
      "requirements": [
        "符合A/B/C类人才标准",
        "无犯罪记录",
        "经济能力证明"
      ],
      "documents": [
        "护照",
        "学历证明（B/C类）",
        "收入证明（A类）",
        "照片"
      ],
      "official_url": "https://www.immd.gov.hk/hkt/services/visas/TTPS.html",
      "china_passport_eligible": true,
      "notes": "A类：年收入250万港币+；B类：全球百强大学+5年工作经验；C类：全球百强大学（限额）",
      "is_recommended_for_digital_nomad": true
    }
  ]
}