{
  "country_id": "uae",
  "country_name": "阿联酋",
  "updated_at": "2026-01-15T00:00:00Z",
  "source": "阿联酋身份与公民管理局 (ICP), 阿联酋旅游局",
  "visa_types": [
    {
      "id": "ae_visa_free",
      "type": "visa_free",
      "name": "免签入境",
      "name_en": "UAE Visa-Free Entry",
      "duration": "30天",
      "validity": "30天",
      "extendable": true,
      "extend_duration": "30天（付费延期）",
      "fee_usd": 0,
      "processing_days": 0,
      "application_method": "on_arrival",
      "requirements": [
        "有效护照（6个月以上）",
        "回程机票",
        "酒店预订",
        "资金证明"
      ],
      "documents": [
        "护照",
        "往返机票",
        "酒店预订"
      ],
      "official_url": "https://icp.gov.ae/",
      "china_passport_eligible": true,
      "notes": "免签30天，可在境内付费延期30天（约600-1000迪拉姆）。频繁入境可能面临审查",
      "is_recommended_for_digital_nomad": true
    },
    {
      "id": "ae_digital_nomad",
      "type": "digital_nomad_visa",
      "name": "数字游民签证（Virtual Working Programme）",
      "name_en": "UAE Digital Nomad Visa",
      "duration": "1年",
      "validity": "1年",
      "extendable": true,
      "extend_duration": "1年",
      "fee_usd": 287,
      "processing_days": 7,
      "application_method": "online",
      "requirements": [
        "为境外雇主远程工作，或自有境外公司",
        "月收入5000美元+或年收入60,000美元+",
        "健康保险",
        "迪拜住址（可酒店/公寓）"
      ],
      "documents": [
        "护照",
        "照片",
        "申请表",
        "工作合同/公司注册证明",
        "收入证明",
        "银行流水",
        "健康保险",
        "迪拜住址证明"
      ],
      "official_url": "https://www.visitdubai.com/",
      "china_passport_eligible": true,
      "notes": "可在迪拜合法居住1年，可携家属。享受迪拜 residency 福利（银行开户、租房等）。阿布扎比也有类似计划",
      "is_recommended_for_digital_nomad": true
    },
    {
      "id": "ae_golden",
      "type": "special_permit",
      "name": "黄金签证（Golden Visa）",
      "name_en": "UAE Golden Visa",
      "duration": "5-10年",
      "validity": "5-10年",
      "extendable": true,
      "extend_duration": "5-10年",
      "fee_usd": 3000,
      "processing_days": 30,
      "application_method": "online",
      "requirements": [
        "投资者（房产200万迪拉姆+）",
        "企业家",
        "高技能人才",
        "科学家/研究人员",
        "优秀学生"
      ],
      "documents": [
        "护照",
        "照片",
        "申请表",
        "资格证明（投资/学历/工作等）",
        "健康保险",
        "体检报告"
      ],
      "official_url": "https://icp.gov.ae/",
      "china_passport_eligible": true,
      "notes": "长期居留签证，可携家属（配偶、子女、父母）。无需担保人。可100%持有公司股权",
      "is_recommended_for_digital_nomad": false
    }
  ]
}