{
  "country_id": "germany",
  "country_name": "德国",
  "updated_at": "2026-01-15T00:00:00Z",
  "source": "德国联邦外交部, 德国驻华大使馆",
  "visa_types": [
    {
      "id": "de_schengen",
      "type": "visa_required",
      "name": "申根旅游签证（C类）",
      "name_en": "Germany Schengen Tourist Visa",
      "duration": "90天/180天",
      "validity": "90天-5年",
      "extendable": false,
      "fee_usd": 90,
      "processing_days": 15,
      "application_method": "embassy",
      "requirements": [
        "有效护照",
        "旅行保险",
        "往返机票",
        "酒店预订",
        "资金证明",
        "行程单",
        "在职证明"
      ],
      "documents": [
        "护照",
        "照片",
        "申请表",
        "旅行保险",
        "机票",
        "酒店预订",
        "银行流水",
        "在职证明",
        "户口本",
        "营业执照"
      ],
      "official_url": "https://www.germany-visa.org/",
      "china_passport_eligible": true,
      "notes": "德国为申根区，C类签证可通行29个申根国。德国签证较严格，资金证明和回国约束力审核较严",
      "is_recommended_for_digital_nomad": true
    },
    {
      "id": "de_blue_card",
      "type": "work_visa",
      "name": "欧盟蓝卡（EU Blue Card）",
      "name_en": "Germany EU Blue Card",
      "duration": "4年",
      "validity": "4年",
      "extendable": true,
      "extend_duration": "4年",
      "fee_usd": 110,
      "processing_days": 60,
      "application_method": "embassy",
      "requirements": [
        "德国雇主担保",
        "大学本科以上学历",
        "年薪达到门槛（2024年约45,300欧元，稀缺职业约41,041欧元）",
        "专业对口工作"
      ],
      "documents": [
        "护照",
        "照片",
        "学历证明",
        "工作合同",
        "雇主声明",
        "ZAB学历认证"
      ],
      "official_url": "https://www.bamf.de/",
      "china_passport_eligible": true,
      "notes": "高技能移民签证，可携家属。21-27个月（德语B1）或33个月（德语A1）后可申请永居",
      "is_recommended_for_digital_nomad": false
    },
    {
      "id": "de_freelance",
      "type": "work_visa",
      "name": "自由职业签证（Freiberufler）",
      "name_en": "Germany Freelance Visa",
      "duration": "1-3年",
      "validity": "1-3年",
      "extendable": true,
      "extend_duration": "1-3年",
      "fee_usd": 100,
      "processing_days": 60,
      "application_method": "embassy",
      "requirements": [
        "作为自由职业者在德国工作",
        "证明有德国客户和足够收入",
        "健康保险",
        "德国住址",
        "专业资质（如适用）"
      ],
      "documents": [
        "护照",
        "照片",
        "申请表",
        "自由职业计划",
        "客户合同/意向书",
        "资金证明",
        "健康保险",
        "德国住址证明",
        "专业资质证明"
      ],
      "official_url": "https://www.berlin.de/",
      "china_passport_eligible": true,
      "notes": "适合自由职业者、艺术家、咨询师等。柏林等大城市相对容易获批。可携家属",
      "is_recommended_for_digital_nomad": true
    }
  ]
}